"rating","ingredients","product_id","product_name","brand_id","brand_name"
3.7857,"['Water, Glycerin, Carthamus Tinctorius (Safflower) Oleosomes, Pentylene Glycol, Butylene Glycol, C12-15 Alkyl Benzoate, Niacinamide, Zea Mays (Corn) Starch, Hyaluronic Acid, Sodium Hyaluronate, Citrullus Lanatus (Watermelon) Seed Extract, Adansonia Digitata Pulp Extract, Barosma Betulina Leaf Extract, Aloe Barbadensis Leaf Juice, Tocopheryl Acetate, Gluconolactone, Sorbitan Oleate, Acrylates/C10-30 Alkyl Acrylate Crosspolymer, Sodium Acrylate/Sodium Acryloyldimethyl Taurate Copolymer, Dimethicone, Isohexadecane, Ethylhexyl Methoxycrylene, Polysorbate 80, Xanthan Gum, Sodium Hydroxide, Citric Acid, Potassium Hydroxide, Tocopherol, Trisodium Ethylenediamine Disuccinate, Ethylhexylglycerin, Sodium Benzoate, Potassium Sorbate, Phenoxyethanol, Fragrance, Benzyl Salicylate, Citral, Hexyl Cinnamal, Limonene, Linalool, Red 33.']","P480166","Mini Hydra Vizor Invisible Moisturizer Broad Spectrum SPF 30 Sunscreen with Niacinamide",6352,"Fenty Skin"
5,"['Aqua/Water/Eau, Glycerin, Caprylic/Capric Triglyceride, Dicaprylyl Carbonate, Glycereth-26, Niacinamide, Hyaluronic Acid, Sodium Hyaluronate, Panthenol, Tocopheryl Acetate, Citrullus Lanatus (Watermelon) Seed Oil, Backhousia Citriodora Leaf Extract, Cereus Grandiflorus (Cactus) Flower Extract, Hovenia Dulcis Fruit Extract, Adansonia Digitata Seed Oil, Adansonia Digitata Fruit Extract, Camellia Sinensis Leaf Extract, Aloe Barbadensis Leaf Juice, Simmondsia Chinensis (Jojoba) Seed Oil, Tocopherol, Phospholipids, Hydrolyzed Jojoba Esters, Cetearyl Glucoside, Glyceryl Caprylate, Glyceryl Undecylenate, Polyglyceryl-3 Methylglucose Distearate, Hydroxyethyl Acrylate/Sodium Acryloyldimethyl Taurate Copolymer, Cetearyl Alcohol, Ammonium Acryloyldimethyltaurate/Beheneth-25 Methacrylate Crosspolymer, Pentaerythrityl Tetra-Di-T-Butyl Hydroxyhydrocinnamate, Polysorbate 60, Sorbitan Isostearate, Sodium Phytate, Xanthan Gum, Citric Acid, Leuconostoc/Radish Root Ferment Filtrate, Hydroxyacetophenone, Propanediol, Butylene Glycol, Ethylhexylglycerin, Phenoxyethanol, Parfum/Fragrance, Benzyl Salicylate, Hexyl Cinnamal, Linalool, Limonene, Red 4 (Ci 14700), Red 33 (Ci 17200).']","P476496","Instant Reset Brightening Overnight Recovery Gel-Cream with Niacinamide Refill",6352,"Fenty Skin"
5,"['Total Cleanser Remove-It-All Cleanser:', 'Aqua/Water/Eau, Sodium Cocoyl Glycinate, Sodium Cocoamphoacetate, Cocamidopropyl Betaine, Sodium Chloride, Polyglyceryl-10 Laurate, Glycerin, Acrylates/C10-30 Alkyl Acrylate Crosspolymer, Glycol Distearate, Sucrose, Malpighia Punicifolia (Acerola) Fruit Extract, Chaenomeles Sinensis Fruit Extract, Camellia Sinensis Leaf Extract, Ficus Carica (Fig) Fruit Extract, Ginkgo Biloba Leaf Extract, Tocopheryl Acetate, Coconut Acid, Sodium Cocoate, Sodium Metabisulfite, Polyquaternium-7, Sodium Benzotriazolyl Butylphenol Sulfonate, Butylene Glycol, Caprylyl Glycol, Sodium Benzoate, Phenoxyethanol, Parfum/Fragrance, Benzyl Salicylate, Blue 1 (Ci 42090), Red 40 (Ci 16035), Titanium Dioxide (Ci 77891), Yellow 5 (Ci 19140), Yellow 6 (Ci 15985).', 'Fat Water Pore-Refining Toner Serum:', 'Aqua/Water/Eau, Hamamelis Virginiana (Witch Hazel) Water, Butylene Glycol, Niacinamide, Polysorbate 20, Leuconostoc/Radish Root Ferment Filtrate, Backhousia Citriodora Leaf Extract, Camellia Oleifera Leaf Extract, Cereus Grandiflorus (Cactus) Flower Extract, Ficus Carica (Fig) Fruit Extract, Ginkgo Biloba Leaf Extract, Hovenia Dulcis Fruit Extract, Malpighia Punicifolia (Acerola) Fruit Extract, Glycerin, Acrylates/C10-30 Alkyl Acrylate Crosspolymer, Citric Acid, Sodium Hydroxide, Benzoic Acid, Potassium Sorbate, Phenoxyethanol, Parfum/Fragrance, Red 33 (Ci 17200).', 'Hydra Vizor Invisible Moisturizer Broad Spectrum SPF 30:', 'Avobenzone 3%, Homosalate 9%, Octisalate 4.5%, Aqua/Water/Eau, Glycerin, Carthamus Tinctorius Oleosomes, Pentylene Glycol, Butylene Glycol, C12-15 Alkyl Benzoate, Niacinamide, Zea Mays (Corn) Starch, Fragrance/Parfum, Sodium Acrylate/Sodium Acryloyldimethyl Taurate Copolymer, Phenoxyethanol, Isohexadecane, Dimethicone, Ethylhexyl Methoxycrylene, Polysorbate 80, Dl-Alpha Tocopheryl Acetate, Aloe Barbadensis Leaf Juice, Acrylates/C10-30 Alkyl Acrylate Crosspolymer, Sorbitan Oleate, Ethylhexylglycerin, Gluconolactone, Trisodium Ethylenediamine Disuccinate, Sodium Hydroxide, Xanthan Gum, Citric Acid, Potassium Hydroxide, Sodium Benzoate, Barosma Betulina Leaf Extract, Citrullus Lanatus (Watermelon) Seed Extract, Adansonia Digitata Pulp Extract, Hyaluronic Acid, Sodium Hyaluronate, Red 33 (Ci 17200), Potassium Sorbate, D-Alpha Tocopherol, Benzyl Salicylate, Citral, Hexyl Cinnamal, Limonene, Linalool.', 'Pre-Show Glow:', 'Aqua/Water/Eau, Glycolic Acid, Sodium C14-16 Olefin Sulfonate, Butylene Glycol, Cocamidopropyl Betaine, Polyglyceryl-10 Laurate, Glycerin, Potassium Hydroxide, Lactic Acid, Papain, Lactobacillus/Punica Granatum Fruit Ferment Extract, Vaccinium Macrocarpon (Cranberry) Fruit Extract, Malpighia Punicifolia (Acerola) Fruit Extract, Hibiscus Sabdariffa Flower Extract, Aspalathus Linearis Leaf Extract, Panthenol, Cyanocobalamin, Leuconostoc/Radish Root Ferment Filtrate, Citric Acid, Caprylyl Glycol, Sodium Hydroxide, Sodium Chloride, Phenoxyethanol, Sodium Benzotriazolyl Butylphenol Sulfonate, Parfum/Fragrance.']","P501886","The Glow Around 4-Piece Travel Skincare Essentials Set",6352,"Fenty Skin"
4.2781,"['Water/Aqua/Eau, Aloe Barbadensis Leaf Juice, Glycerin, Cucumis Sativus (Cucumber) Fruit Wa-ter, Lactic Acid, Glycolic Acid, Sodium Hydroxide, Phenoxyethanol, Chrysanthemum Partheni-um (Feverfew) Extract, Polysorbate 20, Camellia Sinensis Leaf Extract, Citrus Medica Limonum (Lemon) Peel Extract, Citrus Nobilis (Mandarin Orange) Fruit Extract, Glycyrrhiza Glabra (Lico-rice) Root Extract, Potassium Sorbate, Phyllanthus Emblica Fruit Extract, Sodium Benzoate, Cit-ric Acid, Hyaluronic Acid, Chlorphenesin, EDTA, Tetrasodium EDTA.']","P278317","Facial Radiance Pads",5972,"First Aid Beauty"
3.978,"['Diisostearyl Malate, Cera Microcristallina (Microcrystalline Wax, Cire Microcristalline), Sim-Mondsia Chinensis (Jojoba) Seed Oil, Butyrospermum Parkii (Shea) Butter, Vitis Vinifera (Grape) Seed Oil, Copernicia Cerifera Cera (Copernicia Cerifera (Carnauba) Wax/Cire De Car-Nauba), Glyceryl Diisostearate, Dimethicone, Aroma (Flavor), Glycerin, Triisostearin, Isostearyl Alcohol, Avena Sativa (Oat) Kernal Flour, Hyaluronic Acid, Malic Acid, Allantoin, Squalane, To-Copherol, Glycine Soja (Soybean) Oil, Aqua (Water, Eau), Chrysanthemum Parthenium (Fever-Few) Extract, Glycyrrhiza Glabra (Licorice) Root Extract, Camellia Sinensis Leaf Extract, Leuco-Nostoc/Radish Root Ferment Filtrate, Phenoxyethanol, Edta, Citral, Limonene.']","P293008","Ultra Repair Lip Therapy",5972,"First Aid Beauty"
3.9811,"['Aqua (Water, Eau), Caprylic/Capric Triglyceride, Polysorbate 80, Butylene Glycol, Persea Gratissima (Avocado) Oil, Dimethicone, Glycerin,  Retinol,  Magnesium Ascorbyl Phosphate,  Tocopherol, Ceramide NP, Hydrolyzed Hyaluronic Acid, Colloidal Oatmeal, Acetyl Hexapeptide-8, Aloe Barbadensis Leaf Juice, Triolein, Allantoin, Phytosteryl Canola Glycerides, Oleic Acid, Palmitic Acid, Linoleic Acid, Maltodextrin, Glycine Soja (Soybean) Oil, Acrylates/C10-30 Alkyl Acrylate Crosspolymer, Xanthan Gum, Lecithin, Polysorbate 20, Stearic Acid, Leuconostoc/Radish Root Ferment Filtrate, Phenoxyethanol, Sodium Benzoate, Sodium Hydroxide, Citric Acid, Potassium Sorbate.']","P416825","FAB Skin Lab Retinol Serum 0.25% Pure Concentrate",5972,"First Aid Beauty"
4.5854,"['Face Cleanser:', 'Water, SodiumCocoyl Isethionate, Glycerin, Stearic Acid, Aloe Barbadensis Leaf Juice, Stearyl Alcohol,Sodium PCA, Camellia Sinensis Leaf Extract, Chrysanthemum Parthenium (Feverfew) Extract, Glycyrrhiza Glabra (Licorice) Root Extract, Allantoin, Hydroxypropyl Methylcellulose, Disodium Cocoamphodiacetate, Coco Glucoside, Glyceryl Stearate, Disodium EDTA, Caprylyl Glycol, Phenoxyethanol.', 'Facial Radiance Pads:', 'Water, Aloe Barbadensis Leaf Juice, Glycerin, Cucumis Sativus (Cucumber) Fruit Water, Lactic Acid, Glycolic Acid, Sodium Hydroxide, Leuconostoc/Radish Root Ferment Filtrate, Camellia Sinensis (White Tea) Leaf Extract, Chrysanthemum Parthenium (Feverfew) Extract, Glycyrrhiza Glabra (Licorice) Root Extract, Citrus Medica Limonum (Lemon) Peel Extract, Citrus Nobilis (Mandarin Orange) Fruit Extract, Hyaluronic Acid, Phyllanthus Emblica (Indian Gooseberry) Fruit Extract, Polysorbate 20.', 'Ultra Repair Cream:', 'Colloidal Oatmeal, Water, Stearic Acid, Glycerin, C12-15 Alkyl Benzoate, Caprylic/Capric Triglyceride,Glyceryl Stearate, Glyceryl Stearate SE, Cetearyl Alcohol, Caprylyl Glycol, Phenoxyethanol, Butyrospermum Parkii (Shea Butter), Squalane, Allantoin, Sodium Hydroxide, Dimethicone, Xanthan Gum, Disodium EDTA, Chrysanthemum Parthenium (Feverfew) Extract, Camellia Sinensis (White Tea) Leaf Extract, Butylene Glycol, Glycyrrhiza Glabra (Licorice) Root Extract, Eucalyptus Globulus, Ceramide 3.']","P399656","Fab Faves To Go Kit",5972,"First Aid Beauty"
3.8429,"['Aqua (Water, Eau), Ethylhexyl Olivate, Prunus Armeniaca (Apricot) Kernel Oil, Butyl-ene Glycol, Cetyl Alcohol, Glycerin, Mangifera Indica (Mango) Seed Butter, Sodium Acrylates Crosspolymer-2, Cetyl Phosphate, Caffeine, Squalane, Hyaluronic Acid, Pan-thenol, Cucumis Sativus (Cucumber) Fruit Extract, Avena Sativa (Oat) Bran Extract, Aloe Barbadensis Leaf Juice, Camellia Sinensis Leaf Extract, Colloidal Oatmeal, Chrysanthemum Parthenium (Feverfew) Extract, Glycyrrhiza Glabra (Licorice) Root Extract, Citrus Aurantium Dulcis (Orange) Peel Extract, Caprylic/Capric Triglyceride, Caprylyl Glycol, Sodium Phytate, Sodium Polyglutamate, C20-22 Alkyl Phosphate, 1,2-Hexanediol, C20-22 Alcohols, Hydroxyacetophenone, Propanediol, Phenoxyethanol, Potassium Hydroxide.']","P479840","Hydrating Eye Cream with Hyaluronic Acid",5972,"First Aid Beauty"
4.4236,"['Serum Serum Serum:', 'Aqua/Water/Eau, Glycerin, Propanediol, Cyclopentasiloxane, Diglycerin, Xylitol, Pentylene Glycol, Butylene Glycol, PEG/PPG-17/6 Copolymer, Glyceryl Polymethacrylate, Glycereth-26, PEG/PPG-14/7 Dimethyl Ether,  Squalane, Hyaluronic Acid,  Sodium Hyaluronate, Sodium Hyaluronate Crosspolymer, Hydrolyzed Hyaluronic Acid,  Betaine, Octyldodeceth-16, Glyceryl Glucoside, Propylene Glycol, Caprylyl Glycol, Carbomer, Triethanolamine, Acacia Senegal Gum, Gelatin, Panthenol, Xanthan Gum, Trehalose, Urea, Ethylhexylglycerin, Adenosine, 1,2-Hexanediol, Sodium PCA, Serine, Glucose, Algin, Disodium Phosphate, Glyceryl Polyacrylate, Pullulan, Hydrolyzed Glycosaminoglycans, Potassium Phosphate, Red 4 (CI 14700), Benzyl Glycol, Raspberry Ketone.']","P461935","BEAR Facial Toning Device",7037,"FOREO"
4.1228,"['Aqua/Water/Eau, Glycerin, Propanediol, Cyclopentasiloxane, Diglycerin, Xylitol, Pentylene Glycol, Butylene Glycol, PEG/PPG-17/6 Copolymer, Glyceryl Polymethacrylate, Glycereth-26, PEG/PPG-14/7 Dimethyl Ether,  Squalane, Hyaluronic Acid,  Sodium Hyaluronate, Sodium Hyaluronate Crosspolymer, Hydrolyzed Hyaluronic Acid,  Betaine, Octyldodeceth-16, Glyceryl Glucoside, Propylene Glycol, Caprylyl Glycol, Carbomer, Triethanolamine, Acacia Senegal Gum, Gelatin, Panthenol, Xanthan Gum, Trehalose, Urea, Ethylhexylglycerin, Adenosine, 1,2-Hexanediol, Sodium PCA, Serine, Glucose, Algin, Disodium Phosphate, Glyceryl Polyacrylate, Pullulan, Hydrolyzed Glycosaminoglycans, Potassium Phosphate, Red 4 (CI 14700), Benzyl Glycol, Raspberry Ketone.']","P461936","BEAR mini Facial Toning Device",7037,"FOREO"
4.1667,"['Acryloyldimethyl Taurate Copolymer, Hydroxyethylcellulose, Dipropylene Glycol, Fragrance, Sorbitan Isostearate, Polysorbate 60, Butylene Glycol, Gelidium Cartilagineum Extract, Brassica Oleracea Italica (Broccoli) Sprout Extract, Sodium Hyaluronate, Hydrolyzed Hyaluronic Acid, Sodium Acetylated Hyaluronate.']","P433465","Make My Day Activated Mask",7037,"FOREO"
1.8462,"['Aqua/Water/Eau, Glycerin, Propanediol, Cyclopentasiloxane, Diglycerin, Xylitol, Pentylene Glycol, Butylene Glycol, PEG/PPG-17/6 Copolymer, Glyceryl Polymethacrylate, Glycereth-26, PEG/PPG-14/7 Dimethyl Ether,  Squalane, Hyaluronic Acid,  Sodium Hyaluronate, Sodium Hyaluronate Crosspolymer, Hydrolyzed Hyaluronic Acid,  Betaine, Octyldodeceth-16, Glyceryl Glucoside, Propylene Glycol, Caprylyl Glycol, Carbomer, Triethanolamine, Acacia Senegal Gum, Gelatin, Panthenol, Xanthan Gum, Trehalose, Urea, Ethylhexylglycerin, Adenosine, 1,2-Hexanediol, Sodium PCA, Serine, Glucose, Algin, Disodium Phosphate, Glyceryl Polyacrylate, Pullulan, Hydrolyzed Glycosaminoglycans, Potassium Phosphate, Red 4 (CI 14700), Benzyl Glycol, Raspberry Ketone.']","P461937","Serum Serum Serum",7037,"FOREO"
4.7724,"['Aqua (Water), Glycerin, Simmondsia Chinensis (Jojoba) Seed Oil, Helianthus Annuus (Sunflower) Seed Oil, Isostearyl Alcohol, Propanediol, 1,2-Hexanediol, Niacinamide, Pentylene Glycol, Butylene Glycol Cocoate, Cellulose, Macrocystis Pyrifera (Kelp) Extract, Camellia Sinensis Leaf Extract, Argania Spinosa Kernel Oil, Hyaluronic Acid, Ceramide Np, Tocopheryl Acetate, Tocopherol, Maltodextrin, Acrylates/C10-30 Alkyl Acrylate Crosspolymer, Parfum (Fragrance), Ethylcellulose, Xanthan Gum, Sodium Hyaluronate, Sodium Hydroxide, Adenosine, Biosaccharide Gum-1, Phytosphingosine, Hydrogenated Lecithin, Chlorphenesin, Potassium Sorbate, Sodium Benzoate, Limonene, Linalool, Citronellol, Geraniol.']","P500633","Tea Elixir Niacinamide & Hyaluronic Acid Anti-Aging Serum",4348,"fresh"
4.3728,"['Opuntia Ficus-Indica (Cactus) Extract, Citrullus Lanatus (Watermelon) Fruit Extract, Glycerin, Hyaluronic Acid, Gluconolactone, Sodium Polyglutamate, Betaine Salicylate, Salix Alba (Willow) Bark Extract, Melaleuca Alternifolia (Tea Tree) Extract, Hibiscus Sabdariffa Flower Extract, Lactobacillus/Watermelon Fruit Ferment Extract, Cucumis Sativus (Cucumber) Fruit Extract, Saccharum Officinarum (Sugarcane) Extract, Glycyrrhiza Glabra (Licorice) Root Extract, Scutellaria Baicalensis Root Extract, Paeonia Suffruticosa Root Extract, Brassica Oleracea Capitata (Cabbage) Leaf Extract, Ipomoea Batatas Root Extract, Sorbitan Oleate, Levulinic Acid, Sodium Levulinate, Fragrance/Parfum.']","P458219","Watermelon Glow PHA + BHA Pore-Tight Toner",6189,"Glow Recipe"
4.3728,"['Opuntia Ficus-Indica (Cactus) Extract, Citrullus Lanatus (Watermelon) Fruit Extract, Glycerin, Hyaluronic Acid, Gluconolactone, Sodium Polyglutamate, Betaine Salicylate, Salix Alba (Willow) Bark Extract, Melaleuca Alternifolia (Tea Tree) Extract, Hibiscus Sabdariffa Flower Extract, Lactobacillus/Watermelon Fruit Ferment Extract, Cucumis Sativus (Cucumber) Fruit Extract, Saccharum Officinarum (Sugarcane) Extract, Glycyrrhiza Glabra (Licorice) Root Extract, Scutellaria Baicalensis Root Extract, Paeonia Suffruticosa Root Extract, Brassica Oleracea Capitata (Cabbage) Leaf Extract, Ipomoea Batatas Root Extract, Sorbitan Oleate, Levulinic Acid, Sodium Levulinate, Fragrance/Parfum.']","P467762","Mini Watermelon Glow PHA + BHA Pore-Tight Toner",6189,"Glow Recipe"
4.1087,"['Aqua/Water/Eau, Glycerin, Propanediol, Cetearyl Alcohol, Glyceryl Stearate, Persea Gratissima (Avocado) Oil, C9-12 Alkane, Stearic Acid, Butyrospermum Parkii (Shea) Butter, Kaolin, Sodium Lauroyl Glutamate, Persea Gratissima (Avocado) Fruit Extract, Squalane, Niacinamide, Ethylhexylglycerin, Hexylresorcinol, Oryza Sativa (Rice) Extract, Tocopheryl Acetate, Aloe Barbadensis Leaf Juice, Coffea Arabica (Coffee) Fruit Extract, Hyaluronic Acid, Ethylhexyl Palmitate, Sodium Hyaluronate, Retinol, PEI-10, Hydrated Silica, Sodium Chloride, Fructan, Maltodextrin, Spirulina Maxima Extract, CI 75300*, Potassium Chloride, Potassium Phosphate, Butylene Glycol, Sodium Phosphate, Hydrogenated Starch Hydrolysate, Maltooligosyl Glucoside, Arginine, Silica Dimethyl Silylate, Sodium Dilauramidoglutamide Lysine, Sodium Hydroxide, Citric Acid, Caprylyl Glycol, Carthamus Tinctorius (Safflower) Seed Extract, Lavandula Angustifolia (Lavender) Flower/Leaf/Stem Extract, Malachite Extract, Rosmarinus Officinalis (Rosemary) Leaf Extract, PPG-3 Benzyl Ether Myristate, Polyisobutene, PVP, C13-15 Alkane, Acrylates/C10-30 Alkyl Acrylate Crosspolymer, Sodium Hydroxypropylsulfonate Laurylglucoside Crosspolymer, Fragrance/Parfum**, Hexylene Glycol, Potassium Sorbate, Sodium Benzoate, Phenoxyethanol.']","P447791","Avocado Fine Line Eye Cream with Retinol",6189,"Glow Recipe"
4.4323,"['Aqua/Water/Eau, C12-15 Alkyl Benzoate, Glycerin, C13-15 Alkane, Hydrogenated Ethylhexyl Olivate, Arachidyl Alcohol, Capryloyl Glycerin/Sebacic Acid Copolymer, Diheptyl Succinate, Behenyl Alcohol, Cetyl Alcohol, Citrullus Lanatus (Watermelon) Fruit Extract, Mangifera Indica (Mango) Seed Butter, Citrullus Lanatus (Watermelon) Seed Oil, Sodium Hyaluronate, Hibiscus Sabdariffa Flower Extract, Sodium Hyaluronate Crosspolymer, Hyaluronic Acid, Hydrolyzed Hyaluronic Acid, Platonia Insignis Seed Butter, Hydrolyzed Glycosaminoglycans, Hydrolyzed Gardenia Florida Extract, Coffea Arabica (Coffee) Fruit Extract, Equisetum Arvense Extract, Helianthus Annuus (Sunflower) Seed Oil, Arachidyl Glucoside, Tocopherol, Pentylene Glycol, Polyacrylate Crosspolymer-6, Propanediol, Hydroxyethyl Acrylate/Sodium Acryloyldimethyl Taurate Copolymer, Hydrogenated Olive Oil Unsaponifiables, Caprylyl Glycol, Chlorphenesin, Ethylhexylglycerin, Trisodium Ethylenediamine Disuccinate, Myristyl Alcohol, Stearyl Alcohol, Lauryl Alcohol, Sodium Hydroxide, Benzyl Glycol, Maltodextrin, Raspberry Ketone, Phenoxyethanol, Limonene, Hexyl Cinnamal, Fragrance/Parfum.']","P469211","Watermelon Glow AHA Pink Dream Body Cream",6189,"Glow Recipe"
4.4624,"['Water/Aqua/Eau, Propanediol, Glycerin, C13-15 Alkane, Caprylic/Capric Triglyceride, C9-12 Alkane, Prunus Domestica Seed Oil*, Pentylene Glycol, Squalane, Terminalia Ferdinandiana Seed Oil*, Hyaluronic Acid, Sodium Acetylated Hyaluronate, Sodium Hyaluronate, Davidsonia Jerseyana Fruit Extract*, Terminalia Ferdinandiana Fruit Powder*, Podocarpus Elatus Fruit Extract*, Polyglutamic Acid, Pleiogynium Timoriense Fruit Extract*, Sodium Hyaluronate Crosspolymer, Hydrolyzed Sodium Hyaluronate, Epilobium Fleischeri (Alpine Willowherb) Flower/Leaf/Stem Extract, Niacinamide, Acrylates/C10-30 Alkyl Acrylate Crosspolymer, Xylitylglucoside, Isononyl Isononanoate, Caprylyl Glycol, Anhydroxylitol, Cetearyl Alcohol, Glyceryl Stearate, Arginine, Ethylhexylglycerin, Sodium Chloride, Xylitol, Stearic Acid, Tremella Fuciformis Polysaccharide, Sodium Lauroyl Glutamate, Eclipta Prostrata Extract, Glucose, Potassium Phosphate, Butylene Glycol, Melia Azadirachta Leaf Extract, Hydroxypropylcellulose, Alaria Esculenta Extract, Sodium Phosphate, Potassium Chloride, Melia Azadirachta Flower Extract, Corallina Officinalis Extract, 1,2-Hexanediol, Moringa Oleifera Seed Oil, Coccinia Indica Fruit Extract, Citric Acid, Potassium Sorbate, Solanum Melongena (Eggplant) Fruit Extract, Aloe Barbadensis Flower Extract, Gluconolactone, Simmondsia Chinensis (Jojoba) Seed Oil, Curcuma Longa (Turmeric) Root Extract, Ocimum Basilicum (Basil) Flower/Leaf Extract, Ocimum Sanctum Leaf Extract, Silica, Sodium Hydroxide, Sodium Benzoate, Phenoxyethanol, Fragrance/Parfum**.']","P479327","Plum Plump Hyaluronic Acid Moisturizer",6189,"Glow Recipe"
4.1552,"['Citrullus Lanatus (Watermelon) Fruit Extract, Citrullus Lanatus (Watermelon) Seed Oil, Oryza Sativa (Rice) Germ Oil, Moringa Oleifera Seed Extract, Glycine Soja (Soybean) Sterols, Oryza Sativa (Rice) Germ Extract, Cucurbita Pepo (Pumpkin) Seed Oil, Lithospermum Erythrorhizon Root Extract, Alkanna Tinctoria Root Extract, Hyaluronic Acid, Soy Amino Acids, Fructooligosaccharides, Centella Asiatica Extract, Hibiscus Sabdariffa Flower Extract, Natto Gum, Apple Cider Vinegar, Sorbitan Oleate, Scutellaria Baicalensis Root Extract, Paeonia Suffruticosa Root Extract, Glycyrrhiza Glabra (Licorice) Root Extract, Beta-Glucan, Brassica Oleracea Capitata (Cabbage) Leaf Extract, Ipomoea Batatas Root Extract, Fragrance.']","P442744","Watermelon Glow Ultra-Fine Mist",6189,"Glow Recipe"
4.6339,"['Avocado Ceramide Moisture Barrier Cleanser:', 'Water/Aqua/Eau, Glycerin, Hydroxypropyl Starch Phosphate, Potassium Cocoyl Glycinate, Acrylates Copolymer, Persea Gratissima (Avocado) Oil, Lauramidopropyl Betaine, Potassium Cocoate, Glycolipids, Inulin, Ceramide NP, Avena Sativa (Oat) Kernel Flour, Persea Gratissima (Avocado) Fruit Extract, Populus Tremuloides Bark Extract, Saccharide Isomerate, Caprylyl Glyceryl Ether, Propanediol, Polyglyceryl-4 Caprate, Polyglyceryl-6 Caprylate, Myristamidopropyl Betaine, Sodium Chloride, Lauroyl Lysine, Phytosteryl/Octyldodecyl Lauroyl Glutamate, Caprylhydroxamic Acid, Citric Acid, Sodium Hydroxide, Sodium Citrate, Polylysine, Tocopherol, Caprylic/Capric Triglyceride, Elettaria Cardamomum Seed Extract, Jasminum Officinale Flower/Leaf Extract, Camellia Sinensis Leaf Extract, Cananga Odorata Flower Extract, Cucumis Melo Fruit Extract, Cucumis Sativus (Cucumber) Fruit Extract, Lavandula Angustifolia (Lavender) Flower/Leaf/Stem Extract, Pyrus Malus (Apple) Fruit Extract, Rose Extract, Rubus Idaeus (Raspberry) Leaf Extract, Santalum Album (Sandalwood) Wood Extract, Melia Azadirachta Leaf Extract, Amber Powder, Coccinia Indica Fruit Extract, Melia Azadirachta Flower Extract, Solanum Melongena (Eggplant) Fruit Extract, Ocimum Basilicum (Basil) Flower/Leaf Extract, Curcuma Longa (Turmeric) Root Extract, Corallina Officinalis Extract.', 'Watermelon Glow PHA +BHA Pore-Tight Toner:', 'Opuntia Ficus-Indica (Cactus) Extract, Citrullus Lanatus (Watermelon) Fruit Extract, Glycerin, Hyaluronic Acid, Gluconolactone, Sodium Polyglutamate, Betaine Salicylate, Salix Alba (Willow) Bark Extract, Melaleuca Alternifolia (Tea Tree) Extract, Hibiscus Sabdariffa Flower Extract, Lactobacillus/Watermelon Fruit Ferment Extract, Cucumis Sativus (Cucumber) Fruit Extract, Saccharum Officinarum (Sugarcane) Extract, Glycyrrhiza Glabra (Licorice) Root Extract, Scutellaria Baicalensis Root Extract, Paeonia Suffruticosa Root Extract, Brassica Oleracea Capitata (Cabbage) Leaf Extract, Ipomoea Batatas Root Extract, Sorbitan Oleate, Levulinic Acid, Sodium Levulinate, Fragrance/Parfum', 'Strawberry Smooth BHA + AHA Salicylic Serum:', 'Water/Aqua/Eau, Methylpropanediol, C9-12 Alkane, Fragaria Vesca (Strawberry) Fruit Extract, Hydroxypropyl Starch Phosphate, Pentylene Glycol, Salicylic Acid, Succinic Acid, Azelamidopropyl Dimethyl Amine, Mandelic Acid, Fragaria Vesca (Strawberry) Leaf Extract, Allantoin, Sodium Hyaluronate, Bisabolol, Opuntia Ficus-Indica (Prickly Pear) Flower Extract, Niacinamide, Zingiber Officinale (Ginger) Root Extract, Saccharomyces Ferment, Dextrin, Polydextrose, 1,2-Hexanediol, Caprylyl Glycol, Coco-Caprylate/Caprate, Hydroxyacetophenone, Amylopectin, Butylene Glycol, Succinoglycan, Leuconostoc/Radish Root Ferment Filtrate, Lauroyl Lysine, Sodium Phytate, Aminomethyl Propanol, Citric Acid, Fragrance/Parfum.*', 'Watermelon Glow Niacinamide Dew Drops:', 'Aqua/Water/Eau, Propanediol, Glycereth-26, Glycerin, Niacinamide, 2,3-Butanediol, 1,2-Hexanediol, Cetyl Ethylhexanoate, Citrullus Lanatus Fruit Extract, Sodium Hyaluronate, Eclipta Prostrata Extract, Melia Azadirachta Leaf Extract, Polyglyceryl-3 Methylglucose Distearate, Tromethamine, Glyceryl Stearate, Carbomer, Acrylates/C10-30 Alkyl Acrylate Crosspolymer, Ethylhexylglycerin, Xanthan Gum, Polyquaternium-51, Moringa Oleifera Seed Oil, Fragrance/Parfum, Benzyl Benzoate.', 'Plum Plump Hyaluronic Cream:', 'Water/Aqua/Eau, Propanediol, Glycerin, C13-15 Alkane, Caprylic/Capric Triglyceride, C9-12 Alkane, Prunus Domestica Seed Oil*, Pentylene Glycol, Squalane, Terminalia Ferdinandiana Seed Oil*, Hyaluronic Acid, Sodium Acetylated Hyaluronate, Sodium Hyaluronate, Davidsonia Jerseyana Fruit Extract*, Terminalia Ferdinandiana Fruit Powder*, Podocarpus Elatus Fruit Extract*, Polyglutamic Acid, Pleiogynium Timoriense Fruit Extract*, Sodium Hyaluronate Crosspolymer, Hydrolyzed Sodium Hyaluronate, Epilobium Fleischeri (Alpine Willowherb) Flower/Leaf/Stem Extract, Niacinamide, Acrylates/C10-30 Alkyl Acrylate Crosspolymer, Xylitylglucoside, Isononyl Isononanoate, Caprylyl Glycol, Anhydroxylitol, Cetearyl Alcohol, Glyceryl Stearate, Arginine, Ethylhexylglycerin, Sodium Chloride, Xylitol, Stearic Acid, Tremella Fuciformis Polysaccharide, Sodium Lauroyl Glutamate, Eclipta Prostrata Extract, Glucose, Potassium Phosphate, Butylene Glycol, Melia Azadirachta Leaf Extract, Hydroxypropylcellulose, Alaria Esculenta Extract, Sodium Phosphate, Potassium Chloride, Melia Azadirachta Flower Extract, Corallina Officinalis Extract, 1,2-Hexanediol, Moringa Oleifera Seed Oil, Coccinia Indica Fruit Extract, Citric Acid, Potassium Sorbate, Solanum Melongena (Eggplant) Fruit Extract, Aloe Barbadensis Flower Extract, Gluconolactone, Simmondsia Chinensis (Jojoba) Seed Oil, Curcuma Longa (Turmeric) Root Extract, Ocimum Basilicum (Basil) Flower/Leaf Extract, Ocimum Sanctum Leaf Extract, Silica, Sodium Hydroxide, Sodium Benzoate, Phenoxyethanol, Fragrance/Parfum**.']","P504171","Fruit Babies Bestsellers Kit",6189,"Glow Recipe"
