"rating","ingredients","product_id","product_name","brand_id","brand_name"
3.75,"['Banana Bright Vitamin C Serum:', 'Aqua/Water/Eau, 3-O-Ethyl Ascorbic Acid, Neopentyl Glycol Diheptanoate, Gluconolactone, Cetearyl Olivate, Sorbitan Olivate, Citrus Aurantium Dulcis (Orange) Oil, Citrus Aurantium Dulcis (Orange) Peel Oil, Triethyl Citrate, Citrus Sinensis (Orange) Fruit Extract, Helianthus Annuus (Sunflower) Seed Oil, Potassium Hydroxide, Betaine, Panthenol, Phenoxyethanol, Hydroxyacetophenone, Aminomethyl Propanol, Acrylates/C10-30 Alkyl Acrylate Crosspolymer, Gluconic Acid, Tocopherol, Glycerin, Succinoglycan, Phytic Acid, Mica, Sodium Metabisulfite, Sodium Hyaluronate, Hyaluronic Acid, Caramel, Dipotassium Glycyrrhizate, Sodium Polyacrylate, Pentaerythrityl Tetra-Di-T-Butyl Hydroxyhydrocinnamate, Sodium Phytate, Citrus Limon (Lemon) Fruit Extract, Rosa Canina Fruit Extract, Hippophae Rhamnoides Extract, Ascorbic Acid, Lycium Barbarum Fruit Extract, Citrus Aurantium Dulcis (Orange) Fruit Extract, Leuconostoc/Radish Root Ferment Filtrate, Limonene, Linalool, Citral, Titanium Dioxide (Ci 77891), Yellow 5 (Ci 19140), Red 4 (Ci 14700).', 'Glow2OH Dark Spot Toner:', 'Aqua/Water/Eau, Glycolic Acid, Hamamelis Virginiana (Witch Hazel) Water, Lactic Acid, Sodium Hydroxide, Polysorbate 20, Phenoxyethanol, Parfum/Fragrance, Phytic Acid, Ethylhexylglycerin, Glycerin, Chamomilla Recutita (Matricaria) Flower Extract, Citrus Limon (Lemon) Fruit Extract, Glycyrrhiza Glabra (Licorice) Root Extract, Saccharum Officinarum (Sugar Cane) Extract, Santalum Album (Sandalwood) Extract, Benzoic Acid, Leuconostoc/Radish Root Ferment Filtrate, Tocopherol, Citral, Limonene, Linalool.', 'Strength Trainer Peptide Boost Moisturizer:', 'Aqua/Water/Eau, Propanediol, Dicaprylyl Carbonate, Glycerin, Methylpropanediol, Cetearyl Alcohol, Stearyl Alcohol,Mangifera Indica (mango) Seed Butter, Niacinamide, Acetyl Hexapeptide-1, Acetyl Hexapeptide-8, Acetyl Octapeptide-3, Acetyl Tetrapeptide-2, Acetyl Dipeptide-1 Cetyl Ester, Palmitoyl Tripeptide-1, Palmitoyl Tetrapeptide-7, Carnosine, Ceramide np, Ceramide ap, Ceramide eop, Collagen, Serine, Alanine, Glycine, Glutamic Acid, Lysine hcl, Threonine, Arginine, Proline, Hyaluronic Acid, Sodium Hyaluronate, Linoleic Acid, Linolenic Acid, Sodium pca, Sodium Lactate, Panthenol, Tocopherol, Tocopheryl Acetate, Betaine, pca, Cyanocobalamin, Xylitol, Anhydroxylitol, Xylitylglucoside, Sorbitan Olivate, Carbomer, Hydroxyethylcellulose, Xanthan Gum, Cetearyl Olivate, Sorbitan Laurate, Phytosphingosine, Cholesterol, Polysorbate 60, Butylene Glycol, Hydroxyacetophenone, Glycine Soja(Soybean) Oil, Acrylates/c10-30 Alkyl Acrylate Crosspolymer, Polysorbate 20, Ammonium Acryloyldimethyltaurate/Beheneth-25 Methacrylate Crosspolymer, Dimethicone, Sodium Phytate, Sodium Lauroyl Lactylate, Pentaerythrityl Tetra-Di-T-Butyl Hydroxyhydrocinnamate, Leuconostoc/Radish Root Ferment Filtrate, Citric Acid, Caprylyl Glycol, Ethylhexylglycerin, Phenoxyethanol, Parfum/Fragrance*, Citral, Limonene, Linalool.']","P503876","OLE Glow Icons Skincare Set",5674,"OLEHENRIKSEN"
4.5714,"['Aqua/Water/Eau, Pentylene Glycol, Polyquaternium-37, Dicaprylyl Carbonate, Glycerin, Dipropylene Glycol, Polyglyceryl-6 Stearate, Hydrogenated Ethylhexyl Olivate, Parfum/Fragrance, Polysilicone-29, Polyquaternium-16, Dimethicone, Hydroxypropyl Guar Hydroxypropyltrimonium Chloride, Chlorphenesin, Sodium Benzoate, Citrus Limon (Lemon) Peel Extract, Synthetic Fluorphlogopite, Disodium EDTA, Lauryl Glucoside, Hydrolyzed Hyaluronic Acid, Polyglyceryl-6 Behenate, Salvia Hispanica Seed Extract, Sorbitan Oleate, Chamomilla Recutita (Matricaria) Flower Extract, Trehalose, Caprylyl/Capryl Glucoside, Xylitol, Butylene Glycol, Zingiber Officinale (Ginger) Root Extract, Citric Acid, Quaternium-95, Phenoxyethanol, Ethyl Linoleate, Glycolic Acid, Ethyl Oleate, Lactic Acid, Hydrolyzed Verbascum Thapsus Flower, Hydrogenated Olive Oil Unsaponifiables, Leuconostoc/Radish Root Ferment Filtrate, Sodium Hyaluronate, Propanediol, Sodium Phosphate, Benzyl Alcohol, Citrullus Lanatus (Watermelon) Seed Oil, Oryza Sativa (Rice) Bran Extract, Potassium Sorbate, Litchi Chinensis Fruit Extract, Caprylic Acid, Tocopherol, Pentaerythrityl Tetra-Di-T-Butyl Hydroxyhydrocinnamate, Lavandula Angustifolia (Lavender) Flower Extract, Opuntia Tuna Fruit Extract, Viola Odorata Flower Extract, Alcohol, Helianthus Annuus (Sunflower) Extract, Leontopodium Alpinum Extract, Tin Oxide, BHT, Rosmarinus Officinalis (Rosemary) Leaf Extract, Aminomethyl Propanol, Hexyl Cinnamal, Limonene, Linalool, CI 77891 (Titanium Dioxide), CI 60730 (Ext. Violet 2).']","P469040","Bright Blonde Essential Priming Hair Serum",6346,"Oribe"
3.4286,"['Water/Aqua/Eau, Butylene Glycol, Bis-Peg-18 Methyl Ether Dimethyl Silane, Glycerin, Sodium Stearate, Pentylene Glycol, 1,2-Hexanediol, Adenosine, Allantoin, Aloe Barbadensis Leaf Juice, Asiaticoside, Centella Asiatica Leaf Extract, Sodium Hyaluronate, Sodium Hyaluronate Crosspolymer, Chrysin, Citric Acid, Ethylhexylglycerin, Hydrolyzed Hyaluronic Acid, Hydroxypropyltrimonium Hyaluronate, Madecassoside, N-Hydroxysuccinimide, Niacinamide, Palmitoyl Tetrapeptide-7, Palmitoyl Tripeptide-1, Pancratium Maritimum Extract, Sodium Acetylated Hyaluronate, Bht, Biotin, Sodium Citrate, Steareth-20, Chlorhexidine Digluconate, Potassium Sorbate, Sodium Benzoate.']","P475597","IntensifEYES Artistry Wand",6160,"PAT McGRATH LABS"
4.5,"['Water/Aqua/Eau, Dicaprylyl Carbonate, Glycerin, Triheptanoin, 3-O-Ethyl Ascorbic Acid, Ascorbyl Glucoside, Hydroxyethyl Acrylate/Sodium Acryloyldimethyl Taurate Copolymer, Arachidyl Alcohol, C13-16 Isoalkane, Cetearyl Alcohol, Butylene Glycol, Ascorbyl Palmitate, Tocopheryl Acetate, Bacillus Ferment, Oryza Sativa (Rice) Bran Extract, Cetearyl Olivate, Sorbitan Olivate, Helianthus Annuus (Sunflower) Extract, 1,2-Hexanediol, Sh-Polypeptide-121, Behenyl Alcohol, Propanediol, Hydrogenated Lecithin, Sodium Citrate, Tocopherol, Cetyl Alcohol, Butyrospermum Parkii (Shea) Butter, Arachidyl Glucoside, Caprylyl Glycol, Sodium Metabisulfite, Ethylhexylglycerin, Hexylene Glycol, Sodium Phytate, Sorbitan Isostearate, Hyaluronic Acid, Rosmarinus Officinalis (Rosemary) Leaf Extract, Citric Acid, Sodium Sulfite, Zerumbone, Acetyl Hexapeptide-8, Phenoxyethanol.']","P501288","C5 Super Boost Vitamin C Eye Cream",6341,"Paula's Choice"
4.413,"['Water (Aqua), Glycerin, Sodium Hyaluronate, Hyaluronic Acid, Ceramide NP, Ceramide AP, Ceramide EOP, Phytosphingosine, Yeast Extract, Adenosine, Cholesterol, Panthenol, Silanetriol, Butylene Glycol, Sodium Lauroyl Lactylate, Carbomer, Xanthan Gum, Citric Acid, Sodium Hydroxide, Polysorbate 20, Ethylhexylglycerin, Phenoxyethanol.']","P469508","Hyaluronic Acid Booster",6341,"Paula's Choice"
4.5597,"['Water (Aqua), Glycerin, Sodium Stearate, Sodium Cocoyl Isethionate, Myristic Acid, Propanediol, Palmitic Acid, Caprylic/Capric Triglyceride, Cellulose Acetate, Polyglyceryl-10 Laurate, Stearic Acid, Glyceryl Behenate, Hydrogenated Jojoba Oil, Copernicia Cerifera (Carnauba) Wax, Polyglyceryl-2 Stearate, Alanine, Arginine, Ceramide NG, Threonine, Salicylic Acid, Niacinamide, Hydrolyzed Hyaluronic Acid, Lysine HCL, Glycine, Proline, Serine, Glutamic Acid, Vitis Vinifera (Grape) Seed Oil, Chamaecyparis Obtusa Leaf Extract, Citrus Unshiu Fruit Extract, Glycyrrhiza Glabra (Licorice) Root Extract, Lactobacillus Ferment, Betaine, Dextrin, PCA, Polydextrose, Sodium Lactate, Caprylhydroxamic Acid, Sodium PCA, Amylopectin, Benzyl Alcohol, Trisodium Ethylenediamine Disuccinate, Lauric Acid, Coconut Acid, Sodium Isethionate.']","P469530","Blemish Balm Cleanser",6209,"Peace Out"
4.6912,"['Water/Aqua/Eau, Glycerin, Vegetable Collagen, Chondrus Crispus Powder, Dipropylene Glycol, Soluble Collagen, Hydrolyzed Collagen, Hydrolyzed Hyaluronic Acid, Collagen Amino Acids, Hyaluronic Acid, Allantoin, Caffeine, Squalane, Adenosine, Niacinamide, Hydrolyzed Extensin, Hydroxystearic Acid, Dipalmitoyl Hydroxyproline, Tripeptide-1, Chondrus Crispus Extract, Leuconostoc/Radish Root Ferment Filtrate, Sodium Hyaluronate, Palmitic Acid, Hydroxypropyltrimonium Hyaluronate, Potassium Sorbate, Sodium Acetylated Hyaluronate, Dextrin, Sodium Hyaluronate Crosspolymer, Hydrolyzed Sodium Hyaluronate, Potassium Hyaluronate, Xanthan Gum, Ceratonia Siliqua (Carob) Gum, Synthetic Fluorphlogopite, Calcium Lactate, Chlorphenesin, Disodium Edta, 1,2-Hexanediol, Butylene Glycol, Titanium/Titanium Dioxide, Potassium Chloride, Ethylhexylglycerin, Titanium Dioxide/CI 77891, Mica/CI 77019, Phenoxyethanol.']","P500244","FIRMx Collagen Face & Eye Hydra-Gel Patches",3728,"Peter Thomas Roth"
4.6173,"['Water (Aqua/Eau), Nelumbo Nucifera (Lotus) Flower Water, Propanediol, Cetearyl Alcohol, Behentrimonium Chloride**, Helianthus Annuus (Sunflower) Seed Oil, Glycerin, Withania Somnifera (Ashwagandha) Herb Extract, Hibiscus Sabdariffa (Hibiscus) Flower Extract, Ocimum Sanctum (Tulsi) Leaf Extract, Tocopherol+, Hydrolyzed Wheat Protein, Jasminum Officinale (Jasmine) Flower Extract, Panthenol, Hydrolyzed Glycosaminoglycans, Hydrolyzed Rice Protein, Hyaluronic Acid, Benzyl Alcohol, Dehydroacetic Acid, Citric Acid.']","P503863","Regenerative Veda⁴ Bond Repair Conditioner- Mighty Majesty",6475,"RANAVAT"
4.4882,"['Water/Aqua/Eau, Dimethicone, Methyl Trimethicone, Dipropylene Glycol, Glycerin, Butylene Glycol, Vinyl Dimethicone/Methicone Silsesquioxane Crosspolymer, Dimethicone/Vinyl Dimethicone Crosspolymer, Cetyl PEG/PPG-10/1 Dimethicone, Sodium Chloride, Dimethicone/PEG-10/15 Crosspolymer, Silica, Propanediol, Sodium Benzoate, Potassium Sorbate, Tocopheryl Acetate, Eclipta Prostrata Extract, Glyceryl Acrylate/Acrylic Acid Copolymer, Fragrance/Parfum, Camellia Sinensis Leaf Extract, Sodium Citrate, Melia Azadirachta Leaf Extract, Hyaluronic Acid, Hydrolyzed Hyaluronic Acid, Sodium Hyaluronate, Gardenia Florida Fruit Extract, Nelumbo Nucifera Flower Extract, Nymphaea Odorata Root Extract, Moringa Oleifera Seed Oil, Tocopherol.']","P471074","Pore Diffusing Primer - Always an Optimist Collection",6317,"Rare Beauty by Selena Gomez"
3.6892,"['Water/Aqua/Eau, Dimethicone, Methyl Trimethicone, Dipropylene Glycol, Glycerin, Butylene Glycol, Vinyl Dimethicone/Methicone Silsesquioxane Crosspolymer, Dimethicone/Vinyl Dimethicone Crosspolymer, Cetyl PEG/PPG-10/1 Dimethicone, Sodium Chloride, Dimethicone/PEG-10/15 Crosspolymer, Silica, Propanediol, Sodium Benzoate, Potassium Sorbate, Tocopheryl Acetate, Eclipta Prostrata Extract, Glyceryl Acrylate/Acrylic Acid Copolymer, Fragrance/Parfum, Camellia Sinensis Leaf Extract, Sodium Citrate, Melia Azadirachta Leaf Extract, Hyaluronic Acid, Hydrolyzed Hyaluronic Acid, Sodium Hyaluronate, Gardenia Florida Fruit Extract, Nelumbo Nucifera Flower Extract, Nymphaea Odorata Root Extract, Moringa Oleifera Seed Oil, Tocopherol.']","P471075","Mini Pore Diffusing Primer- Always An Optimist Collection",6317,"Rare Beauty by Selena Gomez"
4.7103,"['Water/Aqua/Eau, Propanediol, Glycerin, Tricaprylin, Dipropylene Glycol, 1,2-Hexanediol, Polyglyceryl-3 Distearate, Polyurethane-15, Betaine, Sodium Acrylate/Sodium Acryloyldimethyl Taurate Copolymer, Acrylates/C10-30 Alkyl Acrylate Crosspolymer, Glyceryl Stearate, Cetearyl Alcohol, Tromethamine, Polyisobutene, Synthetic Fluorphlogopite, Hyaluronic Acid, Ethylhexylglycerin, Glyceryl Stearate Citrate, Mica, Sorbitan Oleate, Caprylyl/Capryl Glucoside, Citrus Aurantium Bergamia (Bergamot) Fruit Oil, Olea Europaea (Olive) Fruit Oil, Squalane (vegetable), Citrus Aurantium Dulcis (Orange) Peel Oil, Tin Oxide, Solanum Melongena (Eggplant) Fruit Extract, Lavandula Angustifolia (Lavender) Oil, Juniperus Virginiana Oil, Pelargonium Graveolens Flower Oil, Disodium Acetyl Glucosamine Phosphate, Copaifera Officinalis (Balsam Copaiba) Resin, Sodium Glucuronate, Magnesium Sulfate, Myrtus Communis Oil, Artemisia Vulgaris Oil, Rosa Damascena Flower Oil, Ferula Galbaniflua (Galbanum) Resin Oil, Limonene, Linalool, Titanium Dioxide (CI 77891), Iron Oxides (CI 77491).']","P475606","ReEvolve Radiance Locking Hydrating Primer",6166,"rms beauty"
4.8182,"['Water (Aqua), Niacinamide (Vitamin B3), Glycolic Acid, Glyceryl Stearate Citrate, Polyglyceryl-3 Stearate, Hydrogenated Lecithin, Dimethicone, Glycerin, Aloe Barbadensis (Aloe Vera) Leaf Juice, Hyaluronic Acid, Ascorbic Acid (Vitamin C), Tocopheryl (Vitamin E) Acetate, Vaccinium Myrtillus Fruit Extract, Saccharum Officinarum (Sugarcane) Extract, Acer Saccharum (Sugar Maple) Extract, Citrus Aurantium Dulcis (Orange) Fruit Extract, Citrus Limon (Lemon) Fruit Extract, Lactic Acid, Citric Acid, Malic Acid, Tartaric Acid,  Camellia Sinensis (Green Tea) Leaf Extract, Curcuma Longa (Turmeric) Oil, Sodium Polyacrylate, Hydrogenated Polydecane, Tricedeth-6, Melia Azadirachta Leaf Extract, Melia Azadirachta Flower Extract, Amino Esters-1, Coccinia Indica Extract, Solanum Melongena (Eggplant) Fruit Extract, Lawsonia Inermis (Henna) Extract, Ocimum Sanctum Leaf Extract, Pearl Powder, Butylene Glycol, Xanthan Gum, Tetrasodium Glutamate Diacetate, Phenoxyethanol, Ethylhexylglycerin.']","P470247","Blemish Control Booster Serum",7100,"ROSE Ingleton MD"
4.4085,"['Water, Coco-Caprylate/Caprate, Helianthus Annuus (Sunflower) Seed Oil, C15-19 Alkane, Isocetyl Stearoyl Stearate, Undecane, Argania Spinosa Kernel Oil, Jojoba Esters, Tocopheryl Acetate, Tribehenin, Tridecane, Glyceryl Stearate, Leuconostoc/Radish Root Ferment Filtrate, Mica, Titanium Dioxide (CI77891), Glycerin, Lactobacillus, Aloe Barbadensis Leaf, Acacia Senegal Gum, Xanthan Gum, Viola Tricolor Extract, Bisabolol, Glycyrrhiza Glabra (Licorice) Root Extract, Hyaluronic Acid, Glycosphingolipids, GlycolipidsCocos Nucifera (Coconut) Fruit Extract, Symphytum Officinale Leaf Extract, 3-O-Ethyl Ascorbic Acid, Iron Oxide (CI77492), Iron Oxide (CI77491), Iron Oxide (CI77499), Tin Oxide,  Zinc Oxide (15%)']","P469825","Dew Blush Liquid Cheek Blush",6337,"Saie"
4.0939,"['Water, Coco-Caprylate/Caprate, Helianthus Annuus (Sunflower) Seed Oil, C15-19 Alkane, Isocetyl Stearoyl Stearate, Undecane, Argania Spinosa Kernel Oil, Jojoba Esters, Tocopheryl Acetate, Tribehenin, Tridecane, Glyceryl Stearate, Leuconostoc/Radish Root Ferment Filtrate, Mica, Titanium Dioxide (CI77891), Glycerin, Lactobacillus, Aloe Barbadensis Leaf, Acacia Senegal Gum, Xanthan Gum, Viola Tricolor Extract, Bisabolol, Glycyrrhiza Glabra (Licorice) Root Extract, Hyaluronic Acid, Glycosphingolipids, GlycolipidsCocos Nucifera (Coconut) Fruit Extract, Symphytum Officinale Leaf Extract, 3-O-Ethyl Ascorbic Acid, Iron Oxide (CI77492), Iron Oxide (CI77491), Iron Oxide (CI77499), Tin Oxide, Zinc Oxide (15%)']","P468211","Sunvisor Radiant Moisturizing Face Sunscreen SPF 35",6337,"Saie"
3.3333,"['Zinc Oxide (15%), Water, Coco-Caprylate/Caprate, Helianthus Annuus (Sunflower) Seed Oil, C15-19 Alkane, Isocetyl Stearoyl Stearate, Undecane, Argania Spinosa Kernel Oil, Jojoba Esters, Tocopheryl Acetate, Tribehenin, Tridecane, Glyceryl Stearate, Leuconostoc/Radish Root Ferment Filtrate, Mica, Titanium Dioxide (CI 77891), Glycerin, Lactobacillus, Aloe Barbadensis Leaf, Acacia Senegal Gum, Xanthan Gum, Viola Tricolor Extract, Bisabolol, Glycyrrhiza Glabra (Licorice) Root Extract, Hyaluronic Acid, Glycosphingolipids, GlycolipidsCocos Nucifera (Coconut) Fruit Extract, Symphytum Officinale Leaf Extract, 3-O-Ethyl Ascorbic Acid, Iron Oxide (CI 77492), Iron Oxide (CI 77491), Iron Oxide (CI 77499), Tin Oxide.']","P503324","Mini Sunvisor Radiant Moisturizing Face Sunscreen SPF 35",6337,"Saie"
4.5395,"['Water/Aqua/Eau, Glycerin, Glyceryl Polyacrelate, Squalane, Yeast Extract, Caprylyl Glyceryl Ether, Caprylhydroxamic Acid, Propanediol, Oryza Sativa (Rice) Bran Extract, Rosmarinus Officinalis (Rosemary) Leaf Extract, Helianthus Annuus (Sunflower) Extract, Tocopherol (Vitamin E), Butyrospermum Parkii (Shea) Nut Butter, Ascophyllum Nodosum Extract, Full Flower Hemp Extract (CBD), Hydrolyzed Hibiscus Esculentus Extract (Hibiscus Peptides), Dipalmitoyl Hydroxyproline, Hibiscus Sabdariffa Flower Extract (Hibiscus), Phloretin, Magnolol (Magnolia), Honokiol (Magnolia), Punica Granatum Seed Extract (Pomegranate), Polyglyceryl-10 Oleate, Apricot Kernel Oil (Apricot), Polyglyceryl-6 Esters, Sorbitan Palmitate, 3-O-Ethyl Ascorbic Acid (Vitamin C), Polyglyceryl-6 Laurate, Sodium Hyaluronate (Hyaluronic Acid), Eclipta Prostrata Extract (Daisy), Melia Azadirrachta Leaf Extract (Neem), Moringa Pterygosperma Seed Oil (Moringa), Lonicera Caprifolium (Honeysuckle) Flower Extract, Nelumbo Nucifera (Pink Lotus) Flower Oil, Jasminum Grandiflorum (Jasmine) Flower Oil, Acacia Dealbata (Mimosa) Flower Extract, Dextrin, Sodium Benzoate, Potassium Sorbate, Plumeria Alba (Frangipani) Flower.']","P473723","Hydrating Petal Cream – 1% Pure Hyaluronic Acid Moisturizer",6294,"Saint Jane Beauty"
4.9375,"['Water, Caprylic/Capric Triglyceride, Glycerin, C13-15 Alkane, Glyceryl Stearate, Cetyl Alcohol, Laminaria Digitata Extract, Gigartina Stellata Extract, Tocopherol, Hyaluronic Acid, Nelumbo Nucifera (Pink Lotus) Leaf/ Flower Extract, Bletilla hyacinthina (Hyacinth Orchid) Rhizome Extract, Hibiscus Syriacus (Hibiscus) Flower Extract, Citrus Aurantium Amara (Neroli) Oil, Jasminum Officinale (Jasmine) Extract, Chamomilla Recutita (Matricaria) Flower Extract, Chondrus Crispus (Carrageenan) Extract, Camellia Sinensis (Green Tea) Seed Oil, Panthenol, Allantoin, Stearic Acid, Hydroxyethyl Acrylate/Sodium Acryloyldimethyl Taurate Copolymer, Phenoxyethanol, Ethylhexylglycerin.']","P504159","Hydrabloom Body Silk With Hyaluronic Acid",6294,"Saint Jane Beauty"
4.5273,"['Supports a balanced skin microbiome for a healthy and protected skin barrier.', 'Water (Aqua), Squalane, Propanediol, Niacinamide, Triheptanoin, Saccharide Isomerate, Ammonium Acryloyldimethyltaurate/VP Copolymer, Zinc PCA, Hydrolyzed Hyaluronic Acid, Allantoin, Camellia Sinensis Seed Extract, Leptospermone, Flavesone, Isoleptospermone, Acetyl Heptapeptide-4, Citric Acid, Sodium Citrate, Caprylyl Glycol, Trisodium Ethylenediamine Disuccinate, C12-20 Alkyl Glucoside, C14-22 Alcohols, Ethylhexylglycerin, Potassium Sorbate, Phenoxyethanol.']","P481739","Barrier+ Skin Barrier Niacinamide Restoring Gel Cream",6289,"Skinfix"
4.1577,"['Water, Glycerin, Tridecyl Neopentanoate, Cetearyl Ethylhexanoate, Olus Oil (Vegetable Oil), Propanediol, Glyceryl Stearate Citrate, Ammonium Acryloyldimethyltaurate/VP Copolymer, Vitis Vinifera (Grape) Seed Oil, Isosorbide Disunflowerseedate, Isosorbide Dicaprylate, Tetrapeptide-14, Echium Plantagineum Seed Oil, Aspalathus Linearis Extract, Hydrolyzed Hyaluronic Acid, Mel Extract (Honey Extract), Boswellia Serrata Extract, Ceramide NP, Phytosphingosine, Ceramide AP, Cholesterol, Ceramide EOP, Colloidal Oatmeal, Rosa Damascena Flower Water, Cucumis Sativus (Cucumber) Fruit Water, Simmondsia Chinensis (Jojoba) Seed Wax, Olea Europaea (Olive) Husk Oil, Helianthus Annuus (Sunflower) Seed Oil, Camellia Sinensis Leaf Extract, Aloe Barbadensis Leaf Juice, Tocopherol, Trisodium Ethylenediamine Disuccinate, Butylene Glycol, Xanthan Gum, Ethylhexylglycerin, Sodium Lauroyl Lactylate, Carbomer, Phenoxyethanol, Potassium Sorbate, Sodium Benzoate, Citric Acid, Chlorophyllin-Copper Complex (Ci 75810).']","P442850","Redness Recovery+ Antioxidant Redness Treatment Overnight Mask",6289,"Skinfix"
4.5,"['Cucumis Sativus (Cucumber) Extract, Aloe Barbadensis Leaf Juice, Artemesia Pallens Flower Oil, Ascorbyl Palmitate, Bisabolol, Camellia Oleifera (Green Tea) Leaf Extract, Caprylic/Capric Triglyceride, Citrus Aurantifolia Peel Oil, Citrus Aurantium Bergamia Fruit Extract, Citrus Limon Peel Oil, Citrus Nobilis Flower Oil, Citrus Sinensis Peel Oil, Ethyl Acetate, Ethyl Acetoacetate Gamma Undecalactone, Ferula Galbaniflua Resin Oil, Glycerin, Heliotropine, Hyaluronic Acid, Isoamyl Acetate , Isobutyl Acetate, Jasminum Sambac Oil, Opoponax Oil, Polyester-8, Porphyra Umbilicalis Extract, Salvia Sclarea Oil, SD Alcohol 40-B, Tetrahexyldecyl Ascorbate, Tocopherol, Tocopheryl Acetate, VA/Butyl Maleate/Isobornyl Acrylate Copolymer, Water, Avobenzone 3%, Homosalate 7.5%, Octisalate 5%']","P504508","Set + Protect Makeup Setting Spray SPF 30 with Hyaluronic Acid",6750,"Soleil Toujours"
4.6686,"['Aqua (Water/Eau), Dihydroxyacetone, Glycerin, PPG-5-Ceteth-20, Bellis Perennis (Daisy) Flower/Helichrysum Italicum Extract, Echinacea Purpurea Extract, Hydrolyzed Hyaluronic Acid, Sodium Hyaluronate, Xanthan Gum, Biosaccharide Gum-1, Niacinamide, Tocopherol, Malpighia Glabra (Acerola) Fruit Juice, Phenoxyethanol, Caprylyl Glycol, Sodium Metabisulfite, Parfum (Fragrance), Linalool, Caramel, Benzyl Salicylate, Coumarin, Limonene, Hexyl Cinnamal, Hydroxycitronellal, Geraniol, Potassium Sorbate, Citric Acid, Alpha-Isomethyl Ionone.']","P481831","Tan Tonic Glow Drops",5626,"St. Tropez"
4.3905,"['Aqua (Water/ Eau), Dihydroxyacetone, PEG-40 Hydrogenated Castor Oil, Polysorbate 20, Glycerin, Betaine, Phenoxyethanol, Parfum (Fragrance), Citrus Nobilis (Mandarin Orange) Fruit Extract, Sodium Metabisul_te, Beta Vulgaris (Beet) Root Extract, Fructooligosaccharides, Linalool, Ethylhexylglycerin, Propylene Glycol Dicaprylate/ Dicaprate, Potassium Lactate, Limonene, Citronellol, Terminalia Ferdinandiana Seed Oil, Hexyl Cinnamal, Lactic Acid, Hydrolyzed Hyaluronic Acid, Persea Gratissima (Avocado) Fruit Extract, Potassium Sorbate, Hibiscus Sabdariffa Flower Extract, Sodium Benzoate.']","P456206","Self Tan Purity Vitamins Bronzing Water Body Mist",5626,"St. Tropez"
3.3103,"['Water, Dihydroxyacetone, PEG-40 Hydrogenated Castor Oil, Butylene Glycol, Glycereth-26, Dimethyl Isosorbide, Ethoxydiglycol, Hydroxyethylcellulose, Phenoxyethanol, Benzyl Alcohol, Saccharide Isomerate, Citrus Nobilis (Mandarin Orange) Fruit Extract, Sodium Metabisulfite, Parfum (Fragrance), Glycerin, Aloe Barbadensis Leaf Juice, Hydrolyzed Hyaluronic Acid, Linalool, Citrullus Lanatus (Watermelon) Fruit Juice, Limonene, Hexyl Cinnamal, Citronellol, Hibiscus Sabdariffa Flower Extract, Citric Acid, Sodium Citrate, Sodium Benzoate, Potassium Sorbate, Lactic Acid.']","P442747","Self Tan Purity Water Gel",5626,"St. Tropez"
3.2,"['Self Tan Purity Bronzing Water Mousse:', 'Aqua (Water), Dihydroxyacetone, Glycerin, Butylene Glycol, Decyl Glucoside, Ethoxydiglycol, Phenoxyethanol, Saccharide Isomerate, Citrus Nobilis (Mandarin Orange) Fruit Extract, Sodium Metabisulfite, Potassium Sorbate, Citric Acid, Parfum (Fragrance), Linalool, Limonene, Hexyl Cinnamal, Citronellol, Hibiscus Sabdariffa Flower Extract, Sodium Citrate.', 'Self Tan Purity Bronzing Water Face Mist:', 'Aqua (Water), Dihydroxyacetone, PEG-40 Hydrogenated Castor Oil, Phenoxyethanol, Benzyl Alcohol, Glycerin, Saccharide Isomerate, Citrus Nobilis (Mandarin Orange) Fruit Extract, Sodium Metabisulfite, Parfum (Fragrance), Panthenol, Hydrolyzed Hyaluronic Acid, Linalool, Butylene Glycol, Limonene, Hexyl Cinnamal, Citronellol, Hibiscus Sabdariffa Flower Extract, Citric Acid, Sodium Citrate, Potassium Sorbate.']","P456204","Purity Tanning Waters Mini Kit",5626,"St. Tropez"
3.4783,"['Water, Dihydroxyacetone, Butylene Glycol, Caramel, PEG-40 Hydrogenated Castor Oil, Ethoxydiglycol, Polyacrylate Crosspolymer-6, Saccharide Isomerate, Hexylene Glycol, Phenoxyethanol, Benzyl Alcohol, Parfum (Fragrance), Glycine, Melanin, Sodium Metabisulfite, Linalool, Benzyl Salicylate, Hexyl Cinnamal, Hydrolyzed Hyaluronic Acid, t-Butyl Alcohol, Citronellol, Limonene, Geraniol, Citric Acid, Sodium Citrate, Hydroxycitronellal, Leuconostoc/ Radish Root Ferment Filtrate, Alpha-Isomethyl Ionone, Anise Alcohol, Coumarin, CI 14700 (Red 4), CI 42090 (Blue 1).']","P456401","Self Tan Express Bronzing Gel",5626,"St. Tropez"
5,"['Aqua (Water), Diheptyl Succinate, Shea Butter Ethyl Esters, Propanediol, Cetearyl Alcohol, Dihydroxyacetone, Pentaerythrityl Distearate, Cetearyl Glucoside, Tapioca Starch, Saccharomyces Ferment, Ethoxydiglycol, Glycerin, Capsicum Annuum Fruit Extract, Capryloyl/Capryloyl Leucine Isosorbide Esters, Sphingomonas Ferment Extract, Rubus Idaeus (Raspberry) Seed Oil, Vaccinium Myrtillus Seed Oil, Hydrolyzed Hyaluronic Acid, Sodium Hyaluronate, Tocopherol, Biosaccharide Gum-1, Ceteareth-20, Parfum (Fragrance), Phenoxyethanol, Dimethicone, Caprylyl Glycol, Coco-Caprylate/Caprate, Triheptanoin, Xanthan Gum, Capryloyl Glycerin/Sebacic Acid Copolymer, Lauroyl Lysine, Isosorbide, C9-12 Alkane, Dilinoleic Acid/Butanediol Copolymer, Pentaerythrityl Tetra-Di-t-Butyl Hydroxyhydrocinnamate, Benzyl Salicylate, Linalool, Coumarin, Limonene, Sodium Benzoate, Citric Acid, Citronellol, Sodium Salicylate, Castor Oil/IPDI Copolymer.']","P483691","Gradual Tan Classic Daily Youth Boosting Cream",5626,"St. Tropez"
